row_id,tweet_id,date,post_type,language,like_count,retweet_count,reply_count,text,raw_content,hashtags,retweeted_tweet,quoted_tweet,url,user,dataset_split,sampling_strategy,sampled_at
1,1801347589377552891,2024-06-13,retweet,en,275,17,27,@joniernst There will be a blue wave like no one has ever seen before.  Many people are saying it will be a bigly win for Joe Biden.,@joniernst There will be a blue wave like no one has ever seen before.  Many people are saying it will be a bigly win for Joe Biden.,[],False,False,https://twitter.com/keltrott/status/1801347589377552891,"""{'id': 4214425967, 'id_str': '4214425967', 'url': 'https://twitter.com/Kelley Trott \ud83d\udfe6\ud83d\udfe7', 'username': 'Kelley Trott \ud83d\udfe6\ud83d\udfe7', 'rawDescription': 'Girl Mom, pup lover, travel enthusiast, bleeding heart liberal, public school advocate, no DMs, American \ud83c\uddfa\ud83c\uddf8\ud83c\uddfa\ud83c\udde6\ud83c\udf3b', 'created': datetime.datetime(2015, 11, 18, 1, 56, 15, tzinfo=datetime.timezone.utc), 'followersCount': 3615, 'friendsCount': 4578, 'statusesCount': 124767, 'favouritesCount': 411110, 'listedCount': 24, 'mediaCount': 1963, 'location': 'United States', 'profileImageUrl': 'https://pbs.twimg.com/profile_images/1818970715841789952/Lkdg3vSE_normal.jpg', 'profileBannerUrl': 'PW', 'protected': 'PW', 'verified': False, 'blue': False, 'blueType': None, 'descriptionLinks': ['PW'], '_type': 'PW'}""",,stratified_engagement,2026-02-15 21:02:17.120153
2,1801014626538139947,2024-06-12,retweet,en,470,262,24,Trump is the BOSS! https://t.co/3Mb9T5BFeN,Trump is the BOSS! https://t.co/3Mb9T5BFeN,[],False,False,https://twitter.com/MAGA__Patriot/status/1801014626538139947,"""{'id': 3436761485, 'id_str': '3436761485', 'url': 'https://twitter.com/Trump Girl \ud83c\uddfa\ud83c\uddf2\ud83e\udd85\ud83c\uddfa\ud83c\uddf2', 'username': 'Trump Girl \ud83c\uddfa\ud83c\uddf2\ud83e\udd85\ud83c\uddfa\ud83c\uddf2', 'rawDescription': '#America1st #TRUMP2024 #Conservative #Patriot \ud83e\udd85#BackTheBlue\ud83d\udc6e\ud83c\udffb#1A \u2764\ufe0f#2A\ud83e\udd0d #Prolife\ud83d\udc99  #BornInTheUSA \ud83c\uddfa\ud83c\uddf8\ud83c\uddfa\ud83c\uddf8 \ud83d\udeabList', 'created': datetime.datetime(2015, 8, 23, 14, 22, 13, tzinfo=datetime.timezone.utc), 'followersCount': 103414, 'friendsCount': 37566, 'statusesCount': 335650, 'favouritesCount': 46437, 'listedCount': 35, 'mediaCount': 11974, 'location': '', 'profileImageUrl': 'https://pbs.twimg.com/profile_images/1716943253092843520/XsT-thkj_normal.jpg', 'profileBannerUrl': 'PW', 'protected': 'PW', 'verified': False, 'blue': True, 'blueType': None, 'descriptionLinks': ['PW'], '_type': 'PW'}""",,stratified_engagement,2026-02-15 21:02:17.120153
3,1801016730321305632,2024-06-12,retweet,en,1694,276,21,"You have to start with the scoop from @nypost and @EmmaJoNYC. 

Their lede from October was damning:

“Hunter Biden introduced his father, then-Vice President Joe Biden, to a top executive at a Ukrainian energy firm less than a year before the elder Biden pressured government https://t.co/ESDS29uk1Y","You have to start with the scoop from @nypost and @EmmaJoNYC. 

Their lede from October was damning:

“Hunter Biden introduced his father, then-Vice President Joe Biden, to a top executive at a Ukrainian energy firm less than a year before the elder Biden pressured government https://t.co/ESDS29uk1Y",[],False,False,https://twitter.com/DrewHolden360/status/1801016730321305632,"""{'id': 927604589909733376, 'id_str': '927604589909733376', 'url': 'https://twitter.com/Drew Holden', 'username': 'Drew Holden', 'rawDescription': 'Link to my Substack about the media, @Holden_Court, is below. Also seen in: @nytimes @NRO @federalist & more. Keeper of receipts. Maker of\ud83e\uddf5threads\ud83e\uddf5', 'created': datetime.datetime(2017, 11, 6, 18, 32, 23, tzinfo=datetime.timezone.utc), 'followersCount': 170550, 'friendsCount': 3020, 'statusesCount': 49865, 'favouritesCount': 190717, 'listedCount': 944, 'mediaCount': 7529, 'location': 'Washington, DC', 'profileImageUrl': 'https://pbs.twimg.com/profile_images/1466226230475300867/GLL8bkPI_normal.jpg', 'profileBannerUrl': 'PW', 'protected': 'PW', 'verified': False, 'blue': True, 'blueType': None, 'descriptionLinks': ['PW'], '_type': 'PW'}""",,stratified_engagement,2026-02-15 21:02:17.120153
4,1801019544305041422,2024-06-12,retweet,en,345,79,81,"Rachel Maddow Melts Down Over New Trump Theory

The Russiagate hoax queen is now spreading a conspiracy theory that a reelected Donald Trump is going to ship her off to one of his “massive camps.“

“I’m worried about the country broadly if we put someone in power who is openly https://t.co/rwVCoCJ5mP","Rachel Maddow Melts Down Over New Trump Theory

The Russiagate hoax queen is now spreading a conspiracy theory that a reelected Donald Trump is going to ship her off to one of his “massive camps.“

“I’m worried about the country broadly if we put someone in power who is openly https://t.co/rwVCoCJ5mP",[],False,False,https://twitter.com/VigilantFox/status/1801019544305041422,"""{'id': 191871143, 'id_str': '191871143', 'url': 'https://twitter.com/The Vigilant Fox \ud83e\udd8a', 'username': 'The Vigilant Fox \ud83e\udd8a', 'rawDescription': 'Editor-in-Chief @VigilantNews. Writer, video clipper, and pro-freedom citizen journalist with 12 years of healthcare experience.', 'created': datetime.datetime(2010, 9, 17, 15, 38, 32, tzinfo=datetime.timezone.utc), 'followersCount': 1187011, 'friendsCount': 2223, 'statusesCount': 25226, 'favouritesCount': 29086, 'listedCount': 4882, 'mediaCount': 8920, 'location': 'USA', 'profileImageUrl': 'https://pbs.twimg.com/profile_images/1657046545265557504/7wQ3wrAv_normal.jpg', 'profileBannerUrl': 'PW', 'protected': 'PW', 'verified': False, 'blue': True, 'blueType': None, 'descriptionLinks': ['PW'], '_type': 'PW'}""",,stratified_engagement,2026-02-15 21:02:17.120153
5,1801036773797032169,2024-06-12,retweet,en,219,64,216,The White House isn't ruling out a potential commutation for Hunter Biden after his conviction https://t.co/8E9jOvhA5r,The White House isn't ruling out a potential commutation for Hunter Biden after his conviction https://t.co/8E9jOvhA5r,[],False,False,https://twitter.com/AP/status/1801036773797032169,"""{'id': 51241574, 'id_str': '51241574', 'url': 'https://twitter.com/The Associated Press', 'username': 'The Associated Press', 'rawDescription': 'Advancing the power of facts, globally \ud83c\udf0e', 'created': datetime.datetime(2009, 6, 26, 21, 48, 52, tzinfo=datetime.timezone.utc), 'followersCount': 15978138, 'friendsCount': 6503, 'statusesCount': 369644, 'favouritesCount': 4335, 'listedCount': 105957, 'mediaCount': 14298, 'location': 'Global', 'profileImageUrl': 'https://pbs.twimg.com/profile_images/1736863672029310976/gzIskvxa_normal.jpg', 'profileBannerUrl': 'PW', 'protected': 'PW', 'verified': False, 'blue': True, 'blueType': None, 'descriptionLinks': ['PW'], '_type': 'PW'}""",,stratified_engagement,2026-02-15 21:02:17.120153
6,1801008929360502905,2024-06-12,retweet,en,152,35,7,"@SpeakerJohnson MAGA Mike Johnson doesn’t work for the American people, he works for Trump. https://t.co/AXdvIawjCO","@SpeakerJohnson MAGA Mike Johnson doesn’t work for the American people, he works for Trump. https://t.co/AXdvIawjCO",[],False,False,https://twitter.com/Laurieluvsmolly/status/1801008929360502905,"""{'id': 912232086211371008, 'id_str': '912232086211371008', 'url': 'https://twitter.com/\ud83e\udeb4Laurie', 'username': '\ud83e\udeb4Laurie', 'rawDescription': 'Urban Gardener\ud83e\udeb4 Animal Lover\ud83e\udda6 Art\ud83c\udfa8 history\ud83d\udddd\ufe0f literature\ud83d\udcd7Travel \ud83d\udcbaDemocrat\ud83d\uddf3\ufe0f #Resist #Empath #ProChoice #ProudBlue #DemsUnited #FightDisinformation', 'created': datetime.datetime(2017, 9, 25, 8, 27, 32, tzinfo=datetime.timezone.utc), 'followersCount': 19202, 'friendsCount': 14917, 'statusesCount': 160339, 'favouritesCount': 214690, 'listedCount': 212, 'mediaCount': 47920, 'location': '', 'profileImageUrl': 'https://pbs.twimg.com/profile_images/1683009827184713728/bei9fmyD_normal.jpg', 'profileBannerUrl': 'PW', 'protected': 'PW', 'verified': False, 'blue': True, 'blueType': None, 'descriptionLinks': ['PW'], '_type': 'PW'}""",,stratified_engagement,2026-02-15 21:02:17.120153
7,1801349170378199213,2024-06-13,retweet,en,102,20,5,"Many of the Wilmingtonians I talked to were floored to hear that the president's son wasn't acquitted, given who his famous father is and that the trial took place in Biden's backyard.

Here's what Biden's hometown had to say about Hunter's conviction:

https://t.co/qMOWU5agNb","Many of the Wilmingtonians I talked to were floored to hear that the president's son wasn't acquitted, given who his famous father is and that the trial took place in Biden's backyard.

Here's what Biden's hometown had to say about Hunter's conviction:

https://t.co/qMOWU5agNb",[],False,False,https://twitter.com/MiaCathell/status/1801349170378199213,"""{'id': 1963387334, 'id_str': '1963387334', 'url': 'https://twitter.com/Mia Cathell', 'username': 'Mia Cathell', 'rawDescription': \""Investigative reporter @Townhallcom mia.cathell@townhall.com | former American News editor @TPostMillennial | Boston University '21 | Pronounced kuh-THELL\"", 'created': datetime.datetime(2013, 10, 15, 20, 57, 4, tzinfo=datetime.timezone.utc), 'followersCount': 64991, 'friendsCount': 1197, 'statusesCount': 7487, 'favouritesCount': 19543, 'listedCount': 244, 'mediaCount': 893, 'location': 'Living the American Dream \ud83c\uddfa\ud83c\uddf2', 'profileImageUrl': 'https://pbs.twimg.com/profile_images/1685402876191920128/OO_0fmhM_normal.jpg', 'profileBannerUrl': 'PW', 'protected': 'PW', 'verified': False, 'blue': True, 'blueType': None, 'descriptionLinks': ['PW'], '_type': 'PW'}""",,stratified_engagement,2026-02-15 21:02:17.120153
8,1801348561478500390,2024-06-13,retweet,en,444,65,6,"@dom_lucre They may be able to afford Biden, but we can’t.","@dom_lucre They may be able to afford Biden, but we can’t.",[],False,True,https://twitter.com/3rdGener/status/1801348561478500390,"""{'id': 41155686, 'id_str': '41155686', 'url': 'https://twitter.com/Allison Dyer', 'username': 'Allison Dyer', 'rawDescription': '\u201cCoincidence is God\u2019s way of remaining Anonymous\u201d', 'created': datetime.datetime(2009, 5, 19, 16, 56, 1, tzinfo=datetime.timezone.utc), 'followersCount': 15531, 'friendsCount': 4915, 'statusesCount': 17415, 'favouritesCount': 29652, 'listedCount': 27, 'mediaCount': 5653, 'location': 'The U S Of A ', 'profileImageUrl': 'https://pbs.twimg.com/profile_images/1760791645367222272/PNGBuD8c_normal.jpg', 'profileBannerUrl': 'PW', 'protected': 'PW', 'verified': False, 'blue': True, 'blueType': None, 'descriptionLinks': ['PW'], '_type': 'PW'}""",,stratified_engagement,2026-02-15 21:02:17.120153
9,1801003649230905458,2024-06-12,retweet,en,420,157,48,The Biden Administration has opened our banking system to the so-called “Mipymes” in Cuba. How will we know that the Cuban regime will not then use them to finance terrorism? See what I think here. https://t.co/6W6J2gQ7ml,The Biden Administration has opened our banking system to the so-called “Mipymes” in Cuba. How will we know that the Cuban regime will not then use them to finance terrorism? See what I think here. https://t.co/6W6J2gQ7ml,[],False,False,https://twitter.com/MaElviraSalazar/status/1801003649230905458,"""{'id': 40282700, 'id_str': '40282700', 'url': 'https://twitter.com/Mar\u00eda Elvira Salazar \ud83c\uddfa\ud83c\uddf8', 'username': 'Mar\u00eda Elvira Salazar \ud83c\uddfa\ud83c\uddf8', 'rawDescription': \""Congresswoman \u2022 5x Emmy Award-winning journalist \u2022 Daughter of exiles \u2022 Nico & Marti's mom \u2022 Representing beautiful South Florida #FL27 \u2600\ufe0f\ud83c\udf34\"", 'created': datetime.datetime(2009, 5, 15, 17, 4, 40, tzinfo=datetime.timezone.utc), 'followersCount': 209232, 'friendsCount': 382, 'statusesCount': 8595, 'favouritesCount': 4171, 'listedCount': 803, 'mediaCount': 4409, 'location': 'Miami, FL', 'profileImageUrl': 'https://pbs.twimg.com/profile_images/1330198139761029120/2BXDHgyI_normal.jpg', 'profileBannerUrl': 'PW', 'protected': 'PW', 'verified': False, 'blue': True, 'blueType': None, 'descriptionLinks': ['PW'], '_type': 'PW'}""",,stratified_engagement,2026-02-15 21:02:17.120153
10,1801027749638803565,2024-06-12,retweet,en,355,4,9,"@MaceAhWindu It isn't nuance though.

Nuance was the rise of Anakin.

This is abject shit.","@MaceAhWindu It isn't nuance though.

Nuance was the rise of Anakin.

This is abject shit.",[],False,False,https://twitter.com/TheMagaHulk/status/1801027749638803565,"""{'id': 1559762417319567361, 'id_str': '1559762417319567361', 'url': 'https://twitter.com/Lucky', 'username': 'Lucky', 'rawDescription': 'Catholic, Paleoconservative, MAGA-Hulk, Attorney at Law', 'created': datetime.datetime(2022, 8, 17, 4, 42, 8, tzinfo=datetime.timezone.utc), 'followersCount': 12147, 'friendsCount': 1047, 'statusesCount': 53323, 'favouritesCount': 64039, 'listedCount': 88, 'mediaCount': 9552, 'location': '', 'profileImageUrl': 'https://pbs.twimg.com/profile_images/1815142857155457024/q2socr0c_normal.jpg', 'profileBannerUrl': 'PW', 'protected': 'PW', 'verified': False, 'blue': True, 'blueType': None, 'descriptionLinks': ['PW'], '_type': 'PW'}""",,stratified_engagement,2026-02-15 21:02:17.120153
11,1801014780318118346,2024-06-12,retweet,en,121,70,15,"Donald Trump admits he still has a gun, despite felony convictions - It is a violation of federal law for someone convicted of felonies to possess a firearm. https://t.co/1S4wVcLcXn

,","Donald Trump admits he still has a gun, despite felony convictions - It is a violation of federal law for someone convicted of felonies to possess a firearm. https://t.co/1S4wVcLcXn

,",[],False,False,https://twitter.com/essenviews/status/1801014780318118346,"""{'id': 2998864022, 'id_str': '2998864022', 'url': 'https://twitter.com/EssenViews', 'username': 'EssenViews', 'rawDescription': 'I helped defeat Trump.\\nhttps://t.co/nVUcF9XjFr', 'created': datetime.datetime(2015, 1, 28, 1, 42, 25, tzinfo=datetime.timezone.utc), 'followersCount': 165123, 'friendsCount': 84189, 'statusesCount': 112719, 'favouritesCount': 152622, 'listedCount': 543, 'mediaCount': 3239, 'location': 'Global Watch ', 'profileImageUrl': 'https://pbs.twimg.com/profile_images/1626283290184544259/KAsi0yi2_normal.jpg', 'profileBannerUrl': 'PW', 'protected': 'PW', 'verified': False, 'blue': True, 'blueType': None, 'descriptionLinks': ['PW'], '_type': 'PW'}""",,stratified_engagement,2026-02-15 21:02:17.120153
12,1801027506415222894,2024-06-12,retweet,en,305,78,46,"This smarmy little bastage needs to be arrested and sentenced to jail. But in the end, the @GOP will do nothing. https://t.co/8YjRVRcyNb","This smarmy little bastage needs to be arrested and sentenced to jail. But in the end, the @GOP will do nothing. https://t.co/8YjRVRcyNb",[],False,False,https://twitter.com/RickyDoggin/status/1801027506415222894,"""{'id': 1494513441234636815, 'id_str': '1494513441234636815', 'url': 'https://twitter.com/A Man Of Memes', 'username': 'A Man Of Memes', 'rawDescription': \""Patriot - Fighting Back Against Liberal Insanity One Meme At A Time - Please, NO TRAINS or DM's - Views expressed here are MY Opinions and nothing more\"", 'created': datetime.datetime(2022, 2, 18, 3, 26, 7, tzinfo=datetime.timezone.utc), 'followersCount': 257116, 'friendsCount': 32132, 'statusesCount': 346588, 'favouritesCount': 33294, 'listedCount': 139, 'mediaCount': 19251, 'location': '', 'profileImageUrl': 'https://pbs.twimg.com/profile_images/1553030410753388544/xWPDhxTJ_normal.jpg', 'profileBannerUrl': 'PW', 'protected': 'PW', 'verified': False, 'blue': True, 'blueType': None, 'descriptionLinks': ['PW'], '_type': 'PW'}""",,stratified_engagement,2026-02-15 21:02:17.120153
13,1801027331563098278,2024-06-12,retweet,en,168,24,10,"BREAKING: Donald Trump says ""We want all the remaining Bitcoin to be made in the USA""

BULLISH. 📈 https://t.co/J7z5OsngIt","BREAKING: Donald Trump says ""We want all the remaining Bitcoin to be made in the USA""

BULLISH. 📈 https://t.co/J7z5OsngIt",[],False,False,https://twitter.com/TOPDOGE007/status/1801027331563098278,"""{'id': 1365938037746720768, 'id_str': '1365938037746720768', 'url': 'https://twitter.com/\ud835\udce3 \ud835\udcde \ud835\udcdf \ud835\udcd3 \ud835\udcde \ud835\udcd6 \ud835\udcd4', 'username': '\ud835\udce3 \ud835\udcde \ud835\udcdf \ud835\udcd3 \ud835\udcde \ud835\udcd6 \ud835\udcd4', 'rawDescription': 'Digital Marketing Ninja || Social Media Wizard \ud83c\uddf2\ud83c\uddf9 DM \u2709\ufe0f Open For Business Inquiry || Promotions', 'created': datetime.datetime(2021, 2, 28, 8, 13, 22, tzinfo=datetime.timezone.utc), 'followersCount': 103195, 'friendsCount': 2857, 'statusesCount': 43217, 'favouritesCount': 129809, 'listedCount': 206, 'mediaCount': 4490, 'location': 'Malta', 'profileImageUrl': 'https://pbs.twimg.com/profile_images/1815174076773593088/g1p6Xzdl_normal.jpg', 'profileBannerUrl': 'PW', 'protected': 'PW', 'verified': False, 'blue': True, 'blueType': None, 'descriptionLinks': ['PW'], '_type': 'PW'}""",,stratified_engagement,2026-02-15 21:02:17.120153
14,1801036029169893595,2024-06-12,retweet,en,234,184,7,"🧵Well-placed sources tell us that Trump White House leaker and queen Trump HATER, @KMWalsh_gop, and her husband Mike Shield have been “FIRED” from the RNC and given a promotion at the Trump Super PAC! 

Walsh and Shields (like LaCavita the🐍) have made millions off hating on https://t.co/v9uoHmNDO2","🧵Well-placed sources tell us that Trump White House leaker and queen Trump HATER, @KMWalsh_gop, and her husband Mike Shield have been “FIRED” from the RNC and given a promotion at the Trump Super PAC! 

Walsh and Shields (like LaCavita the🐍) have made millions off hating on https://t.co/v9uoHmNDO2",[],False,False,https://twitter.com/TheGeorgeHQ/status/1801036029169893595,"""{'id': 1074588740239147009, 'id_str': '1074588740239147009', 'url': 'https://twitter.com/GEORGE NEWS', 'username': 'GEORGE NEWS', 'rawDescription': 'Investigative Journalism since 2014 | https://t.co/wYDU4IrIOu', 'created': datetime.datetime(2018, 12, 17, 8, 54, 55, tzinfo=datetime.timezone.utc), 'followersCount': 208261, 'friendsCount': 1234, 'statusesCount': 14536, 'favouritesCount': 41479, 'listedCount': 424, 'mediaCount': 3720, 'location': 'Washington, D.C.', 'profileImageUrl': 'https://pbs.twimg.com/profile_images/1635550384709156865/Ecp8OlQf_normal.jpg', 'profileBannerUrl': 'PW', 'protected': 'PW', 'verified': False, 'blue': True, 'blueType': None, 'descriptionLinks': ['PW'], '_type': 'PW'}""",,stratified_engagement,2026-02-15 21:02:17.120153
15,1801032860377161957,2024-06-12,retweet,en,461,18,152,@POTUS Who actually believes Joe Biden…?,@POTUS Who actually believes Joe Biden…?,[],False,False,https://twitter.com/GuntherEagleman/status/1801032860377161957,"""{'id': 1355721251180961792, 'id_str': '1355721251180961792', 'url': 'https://twitter.com/Gunther Eagleman\u2122', 'username': 'Gunther Eagleman\u2122', 'rawDescription': 'Political Commentator - America First - MAGA - Trump 2024 - Unfiltered', 'created': datetime.datetime(2021, 1, 31, 3, 35, 19, tzinfo=datetime.timezone.utc), 'followersCount': 909044, 'friendsCount': 99895, 'statusesCount': 155652, 'favouritesCount': 678162, 'listedCount': 2255, 'mediaCount': 12657, 'location': 'Hill Country, Texas ', 'profileImageUrl': 'https://pbs.twimg.com/profile_images/1606836521784512512/Xb-_cXXi_normal.jpg', 'profileBannerUrl': 'PW', 'protected': 'PW', 'verified': False, 'blue': True, 'blueType': None, 'descriptionLinks': ['PW'], '_type': 'PW'}""",,stratified_engagement,2026-02-15 21:02:17.120153
16,1801017571321262290,2024-06-12,retweet,en,601,38,9,@OliLondonTV took her 8 months - she is meaningless and it is all part of trying to push Biden reelection,@OliLondonTV took her 8 months - she is meaningless and it is all part of trying to push Biden reelection,[],False,False,https://twitter.com/AdlerJoelle/status/1801017571321262290,"""{'id': 1391323933333463042, 'id_str': '1391323933333463042', 'url': 'https://twitter.com/JBA Meet me in the Middle extremes are Bad', 'username': 'JBA Meet me in the Middle extremes are Bad', 'rawDescription': 'Entrepreneur, believing in Individual Freedom, Anti-Globalism, Decentralization Technology, & passionate to support LOCAL \\n#BuyLocalByLocal', 'created': datetime.datetime(2021, 5, 9, 9, 27, 46, tzinfo=datetime.timezone.utc), 'followersCount': 7019, 'friendsCount': 4173, 'statusesCount': 57750, 'favouritesCount': 274361, 'listedCount': 84, 'mediaCount': 782, 'location': 'Canada', 'profileImageUrl': 'https://pbs.twimg.com/profile_images/1809361214658445312/1SUkOeI5_normal.jpg', 'profileBannerUrl': 'PW', 'protected': 'PW', 'verified': False, 'blue': True, 'blueType': None, 'descriptionLinks': ['PW'], '_type': 'PW'}""",,stratified_engagement,2026-02-15 21:02:17.120153
17,1801015048355135505,2024-06-12,retweet,en,299,97,31,"During the 2020 campaign, Joe Biden promised no less than 10 million new ""green jobs."" 

Nearly four years later, where are these green jobs? 

Promises made, promises broken. The Biden Way.","During the 2020 campaign, Joe Biden promised no less than 10 million new ""green jobs."" 

Nearly four years later, where are these green jobs? 

Promises made, promises broken. The Biden Way.",[],False,False,https://twitter.com/DanielTurnerPTF/status/1801015048355135505,"""{'id': 958192618940252160, 'id_str': '958192618940252160', 'url': 'https://twitter.com/Daniel Turner', 'username': 'Daniel Turner', 'rawDescription': 'Founder & Executive Director of @PowerTheFuture | Fighting for American energy, exposing the socialist radical green lies. Sheep & cattle farmer. Views my own.', 'created': datetime.datetime(2018, 1, 30, 4, 18, 17, tzinfo=datetime.timezone.utc), 'followersCount': 88729, 'friendsCount': 1832, 'statusesCount': 16549, 'favouritesCount': 40011, 'listedCount': 279, 'mediaCount': 1727, 'location': 'My Farm', 'profileImageUrl': 'https://pbs.twimg.com/profile_images/1699189137574604800/9aluRU8p_normal.jpg', 'profileBannerUrl': 'PW', 'protected': 'PW', 'verified': False, 'blue': True, 'blueType': None, 'descriptionLinks': ['PW'], '_type': 'PW'}""",,stratified_engagement,2026-02-15 21:02:17.120153
18,1801029061717774574,2024-06-12,retweet,en,1179,256,0,"Peter Dutton’s Liberals aren’t even pretending to care about future generations anymore, they just copying Donald Trump’s nasty politics:

Anti-climate
Anti -migrant
Anti-women

They really are just the Nasty Party","Peter Dutton’s Liberals aren’t even pretending to care about future generations anymore, they just copying Donald Trump’s nasty politics:

Anti-climate
Anti -migrant
Anti-women

They really are just the Nasty Party",[],False,False,https://twitter.com/sarahinthesen8/status/1801029061717774574,"""{'id': 4553061, 'id_str': '4553061', 'url': 'https://twitter.com/\ud83d\udc9a\ud83c\udf0f Sarah Hanson-Young', 'username': '\ud83d\udc9a\ud83c\udf0f Sarah Hanson-Young', 'rawDescription': 'Senator for South Australia Mum, wife, sister & aunt. Lover of koalas and homemade vegetarian pasta. Greens Party rep for Enviro/Water/Arts/Comms.', 'created': datetime.datetime(2007, 4, 14, 0, 7, 18, tzinfo=datetime.timezone.utc), 'followersCount': 184469, 'friendsCount': 2070, 'statusesCount': 13910, 'favouritesCount': 1609, 'listedCount': 1316, 'mediaCount': 1467, 'location': 'Adelaide, South Australia', 'profileImageUrl': 'https://pbs.twimg.com/profile_images/1369169442664443904/IQP9Rrit_normal.jpg', 'profileBannerUrl': 'PW', 'protected': 'PW', 'verified': False, 'blue': False, 'blueType': None, 'descriptionLinks': ['PW'], '_type': 'PW'}""",,stratified_engagement,2026-02-15 21:02:17.120153
19,1801036975668949283,2024-06-12,retweet,en,157,24,13,Hard to decide which is more frightening for the United States. Four more years of Zombie Biden at the helm of the world's superpower or Calamitous Kamala Harris in charge.,Hard to decide which is more frightening for the United States. Four more years of Zombie Biden at the helm of the world's superpower or Calamitous Kamala Harris in charge.,[],False,True,https://twitter.com/NileGardiner/status/1801036975668949283,"""{'id': 849880970, 'id_str': '849880970', 'url': 'https://twitter.com/Nile Gardiner', 'username': 'Nile Gardiner', 'rawDescription': 'Foreign policy analyst. Former aide to Margaret Thatcher.\\nContributor @telegraph https://t.co/nqc5ElWQaC\\nViews expressed are my own.', 'created': datetime.datetime(2012, 9, 27, 20, 7, 18, tzinfo=datetime.timezone.utc), 'followersCount': 53903, 'friendsCount': 2255, 'statusesCount': 99634, 'favouritesCount': 39389, 'listedCount': 675, 'mediaCount': 776, 'location': 'Washington, DC', 'profileImageUrl': 'https://pbs.twimg.com/profile_images/2733485826/ea8198a6b76c267e8ef27468d31291ee_normal.jpeg', 'profileBannerUrl': 'PW', 'protected': 'PW', 'verified': False, 'blue': True, 'blueType': None, 'descriptionLinks': ['PW'], '_type': 'PW'}""",,stratified_engagement,2026-02-15 21:02:17.120153
